{
  "type": "FeatureCollection",
  "schema": "dailyfuel/map-states/1",
  "source": "U.S. Census Bureau, 2023 cartographic boundary file, states, 1:20,000,000 (cb_2023_us_state_20m)",
  "source_url": "https://www2.census.gov/geo/tiger/GENZ2023/kml/cb_2023_us_state_20m.zip",
  "licence": "Public domain, a work of the United States government",
  "attribution": "State outlines: U.S. Census Bureau, public domain",
  "fetched": "2026-09-24",
  "tolerance_deg": 0.02,
  "precision": 2,
  "min_area_deg2": 0.003,
  "note": "Coordinates are lon, lat. Every border two states share is simplified once, so neighbours still meet. Islands under min_area_deg2 are dropped, but never a state's largest polygon. The Aleutian islands west of the antimeridian are moved 360 degrees west, so they draw next to the rest of Alaska on a Web Mercator map with no world copies.",
  "counts": {
    "features": 51,
    "polygons": 128,
    "points": 5043,
    "dropped_islands": 0
  },
  "features": [
    {"type":"Feature","id":"01","properties":{"code":"AL","name":"Alabama"},"geometry":{"type":"MultiPolygon","coordinates":[[[[-88.4,30.37],[-88.31,30.37],[-88.26,30.32],[-88.14,30.32],[-88.06,30.64],[-88.01,30.68],[-87.93,30.65],[-87.9,30.55],[-87.93,30.49],[-87.8,30.32],[-87.81,30.28],[-87.89,30.24],[-87.52,30.28],[-87.43,30.4],[-87.37,30.44],[-87.44,30.51],[-87.4,30.66],[-87.52,30.74],[-87.63,30.87],[-87.6,31.0],[-85.0,31.0],[-85.04,31.11],[-85.11,31.19],[-85.04,31.54],[-85.06,31.62],[-85.13,31.69],[-85.14,31.84],[-85.07,31.97],[-85.06,32.14],[-84.89,32.26],[-85.01,32.34],[-84.97,32.44],[-85.07,32.58],[-85.19,32.87],[-85.61,34.98],[-88.2,35.0],[-88.1,34.89],[-88.47,31.93],[-88.4,30.37]]]]}},
    {"type":"Feature","id":"02","properties":{"code":"AK","name":"Alaska"},"geometry":{"type":"MultiPolygon","coordinates":[[[[-168.13,65.66],[-168.05,65.57],[-167.85,65.54],[-167.47,65.41],[-166.44,65.32],[-166.35,65.28],[-166.45,65.24],[-166.48,65.17],[-166.63,65.13],[-166.91,65.13],[-166.7,64.99],[-166.43,64.88],[-166.41,64.85],[-166.48,64.8],[-166.48,64.76],[-166.41,64.65],[-166.24,64.58],[-165.0,64.43],[-164.31,64.56],[-163.83,64.57],[-163.41,64.52],[-163.13,64.38],[-163.03,64.48],[-163.03,64.52],[-162.94,64.54],[-162.86,64.5],[-162.77,64.33],[-162.63,64.39],[-162.6,64.48],[-162.54,64.53],[-162.23,64.62],[-162.19,64.67],[-161.88,64.71],[-161.65,64.78],[-161.52,64.75],[-161.38,64.77],[-161.33,64.83],[-161.13,64.9],[-160.94,64.82],[-160.78,64.72],[-160.79,64.62],[-161.2,64.5],[-161.39,64.55],[-161.47,64.51],[-161.5,64.42],[-161.26,64.4],[-160.96,64.22],[-160.94,64.07],[-160.77,63.83],[-160.78,63.75],[-161.07,63.56],[-161.19,63.49],[-161.42,63.46],[-161.98,63.45],[-162.07,63.51],[-162.25,63.54],[-162.4,63.63],[-162.59,63.63],[-162.71,63.58],[-162.35,63.45],[-162.53,63.32],[-162.72,63.21],[-162.82,63.21],[-162.84,63.15],[-163.05,63.06],[-163.32,63.04],[-163.53,63.14],[-163.62,63.14],[-163.73,63.21],[-164.07,63.26],[-164.44,63.2],[-164.61,63.11],[-164.81,62.9],[-164.88,62.81],[-164.84,62.69],[-164.96,62.66],[-165.05,62.6],[-165.1,62.52],[-165.27,62.43],[-165.75,62.06],[-165.74,61.96],[-165.64,61.85],[-165.8,61.83],[-165.94,61.85],[-166.09,61.81],[-166.05,61.77],[-166.14,61.72],[-166.21,61.61],[-166.15,61.51],[-166.08,61.49],[-165.91,61.56],[-165.75,61.49],[-165.92,61.4],[-165.83,61.31],[-165.62,61.28],[-165.64,61.14],[-165.56,61.09],[-165.39,61.08],[-165.33,61.17],[-165.2,61.15],[-165.06,61.06],[-165.19,60.97],[-165.09,60.91],[-165.03,60.84],[-165.04,60.77],[-164.99,60.7],[-165.42,60.55],[-165.36,60.51],[-165.27,60.5],[-164.96,60.53],[-165.02,60.47],[-165.13,60.43],[-164.98,60.35],[-164.7,60.3],[-164.52,60.2],[-164.41,60.1],[-164.13,59.99],[-164.21,59.93],[-164.13,59.85],[-163.77,59.8],[-163.17,59.85],[-162.74,59.97],[-162.52,59.98],[-162.49,60.03],[-162.49,60.13],[-162.45,60.17],[-162.37,60.17],[-162.23,60.06],[-161.7,59.49],[-161.79,59.47],[-161.99,59.34],[-162.05,59.25],[-161.8,58.99],[-161.76,58.85],[-161.82,58.73],[-162.17,58.65],[-162.03,58.61],[-161.8,58.61],[-161.75,58.55],[-161.37,58.67],[-161.34,58.74],[-161.0,58.85],[-160.87,58.88],[-160.82,58.83],[-160.73,58.92],[-160.32,59.07],[-160.26,58.99],[-160.32,58.95],[-160.15,58.87],[-159.98,58.84],[-159.91,58.78],[-159.79,58.82],[-159.71,58.93],[-159.62,58.93],[-159.6,58.88],[-159.64,58.85],[-159.53,58.83],[-159.41,58.77],[-159.06,58.42],[-158.88,58.39],[-158.8,58.41],[-158.7,58.48],[-158.86,58.7],[-158.78,58.75],[-158.77,58.86],[-158.62,58.91],[-158.52,58.86],[-158.56,58.8],[-158.38,58.75],[-158.33,58.67],[-158.23,58.62],[-158.14,58.62],[-157.12,58.87],[-157.02,58.86],[-156.99,58.84],[-157.14,58.68],[-157.48,58.48],[-157.54,58.38],[-157.55,58.28],[-157.48,58.22],[-157.6,58.09],[-157.71,57.66],[-157.68,57.56],[-157.93,57.48],[-158.08,57.36],[-158.32,57.28],[-158.53,57.13],[-158.68,56.99],[-158.66,56.81],[-158.85,56.79],[-158.97,56.84],[-159.83,56.54],[-160.39,56.28],[-160.49,56.08],[-160.59,55.98],[-160.46,55.92],[-160.51,55.87],[-160.79,55.89],[-160.81,56.02],[-161.16,56.01],[-161.81,55.89],[-162.22,55.71],[-162.64,55.39],[-162.9,55.25],[-162.86,55.2],[-163.13,55.18],[-163.31,55.13],[-163.28,55.03],[-163.34,54.97],[-163.43,54.95],[-163.53,55.04],[-163.77,55.06],[-164.34,54.89],[-164.44,54.93],[-164.58,54.9],[-164.58,54.82],[-164.74,54.65],[-164.95,54.58],[-164.94,54.53],[-164.86,54.43],[-164.74,54.39],[-164.46,54.42],[-164.35,54.47],[-164.34,54.52],[-164.26,54.57],[-164.04,54.62],[-163.57,54.62],[-163.22,54.68],[-163.04,54.65],[-163.07,54.71],[-163.18,54.77],[-163.35,54.81],[-162.96,54.99],[-162.83,54.93],[-162.59,54.97],[-162.47,55.05],[-162.41,55.04],[-162.43,54.9],[-162.35,54.84],[-162.28,54.84],[-162.24,54.88],[-162.22,55.03],[-162.12,55.1],[-162.05,55.07],[-161.96,55.11],[-161.79,55.05],[-161.69,55.08],[-161.55,55.07],[-161.58,55.1],[-161.82,55.18],[-161.86,55.27],[-161.69,55.41],[-161.7,55.51],[-161.59,55.62],[-161.39,55.63],[-161.38,55.57],[-161.47,55.5],[-161.51,55.39],[-161.49,55.36],[-161.25,55.36],[-160.98,55.47],[-160.67,55.46],[-160.65,55.51],[-160.52,55.47],[-160.39,55.6],[-160.06,55.72],[-160.03,55.79],[-159.85,55.8],[-159.77,55.85],[-159.63,55.8],[-159.67,55.75],[-159.68,55.66],[-159.76,55.62],[-159.73,55.57],[-159.7,55.57],[-159.57,55.63],[-159.53,55.68],[-159.09,55.83],[-159.1,55.91],[-158.65,55.96],[-158.64,55.99],[-158.43,55.99],[-158.37,56.13],[-158.12,56.23],[-158.21,56.29],[-158.49,56.34],[-158.44,56.43],[-158.37,56.47],[-157.87,56.46],[-157.82,56.51],[-157.92,56.64],[-157.79,56.67],[-157.67,56.61],[-157.5,56.62],[-157.45,56.64],[-157.56,56.7],[-157.53,56.75],[-157.29,56.8],[-157.18,56.77],[-157.03,56.88],[-156.94,56.92],[-156.83,56.9],[-156.7,56.99],[-156.55,56.98],[-156.44,57.12],[-156.34,57.18],[-156.36,57.4],[-156.22,57.45],[-156.01,57.45],[-156.05,57.53],[-155.73,57.55],[-155.72,57.63],[-155.63,57.66],[-155.61,57.78],[-155.35,57.72],[-155.29,57.76],[-155.27,57.82],[-155.1,57.87],[-155.06,57.9],[-155.12,57.95],[-155.03,58.0],[-154.88,58.03],[-154.77,58.0],[-154.58,58.02],[-154.22,58.13],[-154.15,58.21],[-154.07,58.35],[-153.99,58.39],[-154.07,58.44],[-154.0,58.49],[-153.93,58.5],[-153.85,58.61],[-153.59,58.64],[-153.55,58.69],[-153.45,58.71],[-153.37,58.82],[-153.27,58.87],[-153.48,59.0],[-153.6,59.0],[-153.7,59.07],[-154.06,59.07],[-154.18,59.12],[-154.12,59.29],[-154.03,59.33],[-154.0,59.38],[-153.75,59.43],[-153.7,59.46],[-153.76,59.54],[-153.58,59.56],[-153.54,59.63],[-153.16,59.65],[-153.05,59.69],[-152.97,59.88],[-152.86,59.88],[-152.7,59.92],[-152.58,60.05],[-152.55,60.11],[-152.57,60.21],[-152.41,60.29],[-152.38,60.35],[-152.23,60.39],[-152.3,60.41],[-152.33,60.47],[-152.26,60.54],[-152.14,60.58],[-152.04,60.66],[-151.9,60.72],[-151.72,60.71],[-151.7,60.73],[-151.8,60.85],[-151.72,60.9],[-151.48,61.01],[-151.17,61.05],[-151.05,61.16],[-150.94,61.21],[-150.54,61.27],[-150.43,61.25],[-150.2,61.26],[-150.27,61.13],[-150.01,61.14],[-149.72,61.01],[-149.85,60.97],[-149.99,60.88],[-150.19,60.9],[-150.34,61.02],[-150.4,61.04],[-151.06,60.79],[-151.26,60.77],[-151.41,60.71],[-151.28,60.5],[-151.31,60.39],[-151.37,60.37],[-151.42,60.21],[-151.72,60.01],[-151.87,59.77],[-151.64,59.65],[-151.45,59.65],[-151.3,59.7],[-151.21,59.63],[-151.89,59.42],[-151.96,59.34],[-151.98,59.28],[-151.86,59.14],[-151.66,59.09],[-151.43,59.14],[-151.47,59.24],[-151.13,59.21],[-150.94,59.23],[-150.89,59.27],[-150.91,59.31],[-150.82,59.33],[-150.72,59.29],[-150.68,59.31],[-150.58,59.45],[-150.5,59.46],[-150.43,59.34],[-150.39,59.34],[-150.28,59.47],[-149.92,59.69],[-149.84,59.7],[-149.75,59.64],[-149.73,59.71],[-149.63,59.73],[-149.53,59.71],[-149.51,59.77],[-149.6,59.8],[-149.57,59.85],[-149.47,59.9],[-149.38,59.84],[-149.12,59.97],[-148.86,59.92],[-148.8,59.95],[-148.69,59.94],[-148.63,59.92],[-148.48,59.94],[-148.31,60.03],[-148.22,59.98],[-148.25,59.93],[-147.96,59.96],[-147.86,59.87],[-147.91,59.84],[-147.93,59.78],[-147.88,59.76],[-147.39,59.88],[-147.47,59.91],[-147.45,59.95],[-147.34,59.96],[-147.38,60.02],[-146.92,60.29],[-146.69,60.28],[-146.61,60.24],[-146.39,60.33],[-145.99,60.39],[-145.64,60.3],[-145.38,60.35],[-145.14,60.3],[-145.09,60.32],[-144.96,60.29],[-144.93,60.23],[-144.65,60.2],[-144.43,60.15],[-144.35,60.09],[-144.19,60.12],[-144.11,60.1],[-144.01,60.01],[-143.9,59.99],[-143.62,60.04],[-142.91,60.09],[-142.43,60.07],[-141.6,59.96],[-141.39,59.87],[-140.79,59.73],[-140.24,59.69],[-140.18,59.74],[-139.78,59.83],[-139.61,59.82],[-139.59,59.64],[-139.74,59.62],[-139.86,59.55],[-139.42,59.38],[-138.92,59.25],[-138.64,59.13],[-138.22,59.03],[-137.95,58.89],[-137.92,58.84],[-137.94,58.79],[-137.68,58.66],[-137.65,58.61],[-137.08,58.4],[-136.99,58.4],[-136.86,58.32],[-136.72,58.27],[-136.7,58.22],[-136.59,58.22],[-136.54,58.32],[-136.27,58.31],[-136.04,58.38],[-135.73,58.4],[-135.65,58.32],[-135.41,58.34],[-135.31,58.24],[-135.09,58.2],[-135.1,58.29],[-135.05,58.31],[-135.1,58.45],[-134.94,58.46],[-134.75,58.39],[-134.63,58.25],[-134.15,58.2],[-134.08,58.15],[-134.05,58.06],[-133.85,57.94],[-133.7,57.79],[-133.65,57.71],[-133.68,57.63],[-133.52,57.53],[-133.47,57.37],[-133.54,57.24